CUSIP,Ticker,Company,Shares,Delta_Shares,Value,Delta_Value,Delta,Portfolio%
517834107,LVS,LAS VEGAS SANDS CORP COM,16054,-25845,647.3K,-1.04M,-61.7%,0.02%
172908105,CTAS,CINTAS CORP COM,2302,-5168,473.13K,-1.06M,-69.2%,0.01%
98980L101,ZM,ZOOM COMMUNICATIONS INC CL A,6118,-14526,451.32K,-1.07M,-70.4%,0.01%
30225T102,EXR,EXTRA SPACE STORAGE INC COM,60726,-7457,9.02M,-1.11M,-10.9%,0.26%
46625H100,JPM,JPMORGAN CHASE & CO. COM,99381,-4643,24.32M,-1.14M,-4.5%,0.71%
46429B697,USMV,ISHARES TR MSCI USA MIN VOL,0,-13547,0,-1.2M,CLOSE,0%
049468101,TEAM,ATLASSIAN CORPORATION CL A,18252,-5672,3.87M,-1.2M,-23.7%,0.11%
88160R101,TSLA,TESLA INC COM,86151,-4968,23.34M,-1.35M,-5.5%,0.68%
015271109,ARE,ALEXANDRIA REAL ESTATE EQ IN COM,0,-15052,0,-1.47M,CLOSE,0%
512807306,LRCX,LAM RESEARCH CORP COM NEW,84574,-20630,6.16M,-1.5M,-19.6%,0.18%
126650100,CVS,CVS HEALTH CORP COM,0,-34125,0,-1.52M,CLOSE,0%
17275R102,CSCO,CISCO SYS INC COM,22061,-25509,1.36M,-1.57M,-53.6%,0.04%
550021109,LULU,LULULEMON ATHLETICA INC COM,0,-4101,0,-1.59M,CLOSE,0%
98138H101,WDAY,WORKDAY INC CL A,0,-6148,0,-1.62M,CLOSE,0%
532457108,LLY,ELI LILLY & CO COM,10713,-2024,8.84M,-1.67M,-15.9%,0.26%
49271V100,KDP,KEURIG DR PEPPER INC COM,0,-53335,0,-1.71M,CLOSE,0%
13321L108,CCJ,CAMECO CORP COM,101762,-41661,4.19M,-1.72M,-29%,0.12%
95040Q104,WELL,WELLTOWER INC COM,121706,-11512,18.65M,-1.76M,-8.6%,0.55%
229663109,CUBE,CUBESMART COM,0,-41500,0,-1.78M,CLOSE,0%
91324P102,UNH,UNITEDHEALTH GROUP INC COM,45604,-3541,23.87M,-1.85M,-7.2%,0.7%
268150109,DT,DYNATRACE INC COM NEW,126425,-39406,5.96M,-1.86M,-23.8%,0.17%
92826C839,V,VISA INC COM CL A,94005,-5381,32.94M,-1.89M,-5.4%,0.97%
88557W101,QFIN,QIFU TECHNOLOGY INC AMERICAN DEP,28053,-42776,1.26M,-1.92M,-60.4%,0.04%
38141G104,GS,GOLDMAN SACHS GROUP INC COM,24450,-3599,13.36M,-1.97M,-12.8%,0.39%
57636Q104,MA,MASTERCARD INCORPORATED CL A,52667,-3612,28.85M,-1.98M,-6.4%,0.85%
697435105,PANW,PALO ALTO NETWORKS INC COM,14013,-12036,2.43M,-2.09M,-46.2%,0.07%
11120U105,BRX,BRIXMOR PPTY GROUP INC COM,116165,-79660,3.08M,-2.11M,-40.7%,0.09%
758849103,REG,REGENCY CTRS CORP COM,83886,-29322,6.19M,-2.16M,-25.9%,0.18%
482480100,KLAC,KLA CORP COM NEW,7968,-3205,5.42M,-2.18M,-28.7%,0.16%
G66721104,NCLH,NORWEGIAN CRUISE LINE HLDG L SHS,54550,-114977,1.05M,-2.22M,-67.8%,0.03%
78467X109,DIA,SPDR DOW JONES INDL AVERAGE UT SER 1,9583,-5500,4.02M,-2.31M,-36.5%,0.12%
34959E109,FTNT,FORTINET INC COM,121868,-24841,11.73M,-2.39M,-16.9%,0.34%
637417106,NNN,NNN REIT INC COM,0,-59608,0,-2.43M,CLOSE,0%
855244109,SBUX,STARBUCKS CORP COM,2975,-25296,291.82K,-2.48M,-89.5%,<.01%
29670E107,EPRT,ESSENTIAL PPTYS RLTY TR INC COM,155692,-76817,5.08M,-2.51M,-33%,0.15%
866674104,SUI,SUN CMNTYS INC COM,0,-21278,0,-2.62M,CLOSE,0%
554382101,MAC,MACERICH CO COM,0,-134653,0,-2.68M,CLOSE,0%
084670702,BRKB,BERKSHIRE HATHAWAY INC DEL CL B NEW,30004,-5245,16M,-2.8M,-14.9%,0.47%
14174T107,CTRE,CARETRUST REIT INC COM,0,-117673,0,-3.18M,CLOSE,0%
75734B100,RDDT,REDDIT INC CL A,9451,-31749,990.61K,-3.33M,-77.1%,0.03%
253868103,DLR,DIGITAL RLTY TR INC COM,40653,-25698,5.83M,-3.68M,-38.7%,0.17%
902653104,UDR,UDR INC COM,91937,-85159,4.15M,-3.85M,-48.1%,0.12%
194162103,CL,COLGATE PALMOLIVE CO COM,7192,-42286,673.89K,-3.96M,-85.5%,0.02%
44107P104,HST,HOST HOTELS & RESORTS INC COM,0,-229892,0,-4.03M,CLOSE,0%
48251W104,KKR,KKR & CO INC COM,32046,-34979,3.7M,-4.04M,-52.2%,0.11%
291011104,EMR,EMERSON ELEC CO COM,11557,-39741,1.27M,-4.36M,-77.5%,0.04%
464287341,IXC,ISHARES TR GLOBAL ENERG ETF,16835,-106801,708.25K,-4.49M,-86.4%,0.02%
594918104,MSFT,MICROSOFT CORP COM,420623,-13165,158.33M,-4.96M,-3%,4.6%
443573100,HUBS,HUBSPOT INC COM,6274,-11586,3.58M,-6.62M,-64.9%,0.11%
464287804,IJR,ISHARES TR CORE S&P SCP ETF,0,-57962,0,-6.68M,CLOSE,0%
78464A508,SPYV,SPDR SER TR PRTFLO S&P500 VL,18752,-137865,957.66K,-7.04M,-88%,0.03%
023135106,AMZN,AMAZON COM INC COM,413820,-39960,78.91M,-7.62M,-8.8%,2.3%
20825C104,COP,CONOCOPHILLIPS COM,3473,-81989,364.73K,-8.61M,-95.9%,0.01%
191216100,KO,COCA COLA CO COM,148168,-130831,10.6M,-9.36M,-46.9%,0.31%
92189F643,MOAT,VANECK ETF TRUST MRNGSTR WDE MOAT,15450,-129169,1.36M,-11.37M,-89.3%,0.04%
46137V357,RSP,INVESCO EXCHANGE TRADED FD T S&P500 EQL WGT,13845,-65675,2.4M,-11.38M,-82.6%,0.07%
464288257,ACWI,ISHARES TR MSCI ACWI ETF,1867714,-530645,217.39M,-61.76M,-22.1%,6.4%
Total,,,,,3.41B,118.54M,+3.5%,100%
