CUSIP,Ticker,Company,Shares,Delta_Shares,Value,Delta_Value,Delta,Portfolio%
67066G104,NVDA,NVIDIA CORPORATION COM,1907941,226866,208.13M,24.75M,+13.5%,6.1%
007903107,AMD,ADVANCED MICRO DEVICES INC COM,342687,223604,36.51M,23.82M,+187.8%,1.1%
81762P102,NOW,SERVICENOW INC COM,81614,26280,65.05M,20.95M,+47.5%,1.9%
464287549,IGM,ISHARES TR EXPND TEC SC ETF,342590,221155,31.06M,20.05M,+182.1%,0.91%
438516106,HON,HONEYWELL INTL INC COM,218976,93592,46.33M,19.8M,+74.6%,1.4%
922908751,VB,VANGUARD INDEX FDS SMALL CP ETF,108981,64296,24.17M,14.26M,+143.9%,0.71%
458140100,INTC,INTEL CORP COM,1013798,450888,23.34M,10.38M,+80.1%,0.68%
01609W102,BABA,ALIBABA GROUP HLDG LTD SPONSORED ADS,73390,73390,9.95M,9.95M,NEW,0.29%
922908744,VTV,VANGUARD INDEX FDS VALUE ETF,54695,54695,9.45M,9.45M,NEW,0.28%
595112103,MU,MICRON TECHNOLOGY INC COM,135670,103618,12.23M,9.34M,+323.3%,0.36%
722304102,PDD,PDD HOLDINGS INC SPONSORED ADS,383680,74395,45.42M,8.81M,+24.1%,1.3%
235851102,DHR,DANAHER CORPORATION COM,38037,37029,7.81M,7.61M,+3673.5%,0.23%
81369Y704,XLI,SELECT SECTOR SPDR TR INDL,55400,55400,7.26M,7.26M,NEW,0.21%
61174X109,MNST,MONSTER BEVERAGE CORP NEW COM,141540,115240,8.28M,6.74M,+438.2%,0.24%
45104G104,IBN,ICICI BANK LIMITED ADR,203754,191361,6.42M,6.03M,+1544.1%,0.19%
88579Y101,MMM,3M CO COM,36491,36491,5.36M,5.36M,NEW,0.16%
40415F101,HDB,HDFC BANK LTD SPONSORED ADS,166864,77980,11.09M,5.18M,+87.7%,0.32%
98980G102,ZS,ZSCALER INC COM,27083,24892,5.37M,4.94M,+1136.1%,0.16%
874039100,TSM,TAIWAN SEMICONDUCTOR MFG LTD SPONSORED ADS,442571,29662,73.43M,4.92M,+7.2%,2.2%
26884U109,EPR,EPR PPTYS COM SH BEN INT,91714,91714,4.83M,4.83M,NEW,0.14%
81369Y605,XLF,SELECT SECTOR SPDR TR FINANCIAL,574138,95175,28.6M,4.74M,+19.9%,0.84%
872590104,TMUS,T-MOBILE US INC COM,17565,17565,4.68M,4.68M,NEW,0.14%
172967424,C,CITIGROUP INC COM NEW,656745,60491,46.62M,4.29M,+10.1%,1.4%
00724F101,ADBE,ADOBE INC COM,93037,10999,35.9M,4.24M,+13.4%,1.1%
872540109,TJX,TJX COS INC NEW COM,169938,32605,20.69M,3.97M,+23.7%,0.61%
008492100,ADC,AGREE RLTY CORP COM,112702,49282,8.7M,3.8M,+77.7%,0.25%
04965M106,ATAT,ATOUR LIFESTYLE HLDGS LTD SPONSORED ADS,550092,131296,15.6M,3.72M,+31.4%,0.46%
880770102,TER,TERADYNE INC COM,419721,44822,34.68M,3.7M,+12%,1%
494368103,KMB,KIMBERLY-CLARK CORP COM,291164,25189,41.35M,3.58M,+9.5%,1.2%
941848103,WAT,WATERS CORP COM,100345,9489,36.88M,3.49M,+10.4%,1.1%
297178105,ESS,ESSEX PPTY TR INC COM,30022,10801,9.2M,3.31M,+56.2%,0.27%
46120E602,ISRG,INTUITIVE SURGICAL INC COM NEW,6795,6252,3.36M,3.1M,+1151.4%,0.1%
82509L107,SHOP,SHOPIFY INC CL A,43457,30813,4.15M,2.94M,+243.7%,0.12%
42226K105,HR,HEALTHCARE RLTY TR CL A COM,173630,173630,2.93M,2.93M,NEW,0.09%
637870106,NSA,NATIONAL STORAGE AFFILIATES COM SHS BEN IN,73731,73731,2.91M,2.91M,NEW,0.09%
02079K305,GOOGL,ALPHABET INC CAP STK CL A,747994,17726,116.28M,2.76M,+2.4%,3.4%
252131107,DXCM,DEXCOM INC COM,46543,39688,3.18M,2.71M,+579%,0.09%
552953101,MGM,MGM RESORTS INTERNATIONAL COM,149600,85408,4.73M,2.7M,+133.1%,0.14%
478160104,JNJ,JOHNSON & JOHNSON COM,21017,16132,3.45M,2.65M,+330.2%,0.1%
98978V103,ZTS,ZOETIS INC CL A,172018,15683,28.29M,2.58M,+10%,0.83%
55306N104,MKSI,MKS INSTRS INC COM,31903,31903,2.56M,2.56M,NEW,0.07%
00846U101,A,AGILENT TECHNOLOGIES INC COM,287538,21584,33.62M,2.52M,+8.1%,0.99%
30303M102,META,META PLATFORMS INC CL A,106791,4362,61.66M,2.52M,+4.3%,1.8%
92338C103,VLTO,VERALTO CORP COM SHS,397815,25686,38.7M,2.5M,+6.9%,1.1%
278865100,ECL,ECOLAB INC COM,154806,9764,39.15M,2.47M,+6.7%,1.1%
G4124C109,GRAB,GRAB HOLDINGS LIMITED CLASS A ORD,8093495,530162,36.56M,2.39M,+7%,1.1%
23128Q101,CURB,CURBLINE PPTYS CORP COM,97195,97195,2.35M,2.35M,NEW,0.07%
487836108,K,KELLANOVA COM,491553,27900,40.55M,2.3M,+6%,1.2%
456788108,INFY,INFOSYS LTD SPONSORED ADR,139136,125136,2.54M,2.28M,+893.8%,0.07%
G0260P102,AS,AMER SPORTS INC COM SHS,240438,85158,6.42M,2.27M,+54.8%,0.19%
59522J103,MAA,MID-AMER APT CMNTYS INC COM,39311,13208,6.59M,2.21M,+50.6%,0.19%
452327109,ILMN,ILLUMINA INC COM,310480,27305,24.67M,2.17M,+9.6%,0.72%
32054K103,FR,FIRST INDL RLTY TR INC COM,88508,39229,4.78M,2.12M,+79.6%,0.14%
98419M100,XYL,XYLEM INC COM,224930,16693,26.87M,1.99M,+8%,0.79%
46436F103,IAUM,ISHARES GOLD TR SHARES REPRESENT,63891,63891,1.99M,1.99M,NEW,0.06%
91704F104,UE,URBAN EDGE PPTYS COM,100300,100300,1.91M,1.91M,NEW,0.06%
29444U700,EQIX,EQUINIX INC COM,22058,2311,17.98M,1.88M,+11.7%,0.53%
92537N108,VRT,VERTIV HOLDINGS CO COM CL A,35281,25897,2.55M,1.87M,+276%,0.07%
461202103,INTU,INTUIT COM,11065,2900,6.79M,1.78M,+35.5%,0.2%
761152107,RMD,RESMED INC COM,54495,7911,12.1M,1.76M,+17%,0.35%
58933Y105,MRK,MERCK & CO INC COM,138303,17658,12.37M,1.58M,+14.6%,0.36%
78377T107,RHP,RYMAN HOSPITALITY PPTYS INC COM,16800,16800,1.54M,1.54M,NEW,0.05%
370334104,GIS,GENERAL MLS INC COM,367895,25454,21.95M,1.52M,+7.4%,0.64%
867892101,SHO,SUNSTONE HOTEL INVS INC NEW COM,159804,159804,1.5M,1.5M,NEW,0.04%
03064D108,COLD,AMERICOLD REALTY TRUST INC COM,185307,67734,3.98M,1.45M,+57.6%,0.12%
87612E106,TGT,TARGET CORP COM,16748,13431,1.78M,1.43M,+404.9%,0.05%
29355A107,ENPH,ENPHASE ENERGY INC COM,27070,22426,1.64M,1.36M,+482.9%,0.05%
038222105,AMAT,APPLIED MATLS INC COM,12326,8807,1.82M,1.3M,+250.3%,0.05%
78463V107,GLD,SPDR GOLD TR GOLD SHS,82344,4429,23.73M,1.28M,+5.7%,0.7%
674599105,OXY,OCCIDENTAL PETE CORP COM,25735,25735,1.27M,1.27M,NEW,0.04%
09062X103,BIIB,BIOGEN INC COM,53280,9014,7.33M,1.24M,+20.4%,0.21%
19260Q107,COIN,COINBASE GLOBAL INC COM CL A,6423,6423,1.21M,1.21M,NEW,0.04%
46429B598,INDA,ISHARES TR MSCI INDIA ETF,99436,23111,5.12M,1.19M,+30.3%,0.15%
35671D857,FCX,FREEPORT-MCMORAN INC CL B,39949,29082,1.6M,1.16M,+267.6%,0.05%
24703L202,DELL,DELL TECHNOLOGIES INC CL C,16083,11764,1.56M,1.14M,+272.4%,0.05%
37954Y871,URA,GLOBAL X FDS GLOBAL X URANIUM,74373,47810,1.7M,1.09M,+180%,0.05%
464287523,SOXX,ISHARES TR ISHARES SEMICDTR,13583,4643,2.55M,873.32K,+51.9%,0.07%
19247G107,COHR,COHERENT CORP COM,47667,13260,3.1M,861.1K,+38.5%,0.09%
09857L108,BKNG,BOOKING HOLDINGS INC COM,11154,186,51.42M,857.52K,+1.7%,1.5%
009066101,ABNB,AIRBNB INC COM CL A,48249,6762,5.8M,813.47K,+16.3%,0.17%
88034P109,TME,TENCENT MUSIC ENTMT GROUP SPON ADS,125106,55782,1.8M,803.26K,+80.5%,0.05%
40434L105,HPQ,HP INC COM,27945,27945,789.68K,789.68K,NEW,0.02%
00206R102,T,AT&T INC COM,38889,27382,1.1M,774.4K,+238%,0.03%
988498101,YUM,YUM BRANDS INC COM,9807,4683,1.55M,738.27K,+91.4%,0.05%
12572Q105,CME,CME GROUP INC COM,2708,2708,718.4K,718.4K,NEW,0.02%
444859102,HUM,HUMANA INC COM,2575,2575,696.23K,696.23K,NEW,0.02%
406216101,HAL,HALLIBURTON CO COM,42721,27399,1.08M,694.29K,+178.8%,0.03%
042068205,ARM,ARM HOLDINGS PLC SPONSORED ADS,9495,6130,1.01M,654.68K,+182.2%,0.03%
670100205,NVO,NOVO-NORDISK A S ADR,29480,9104,2.06M,637.16K,+44.7%,0.06%
68389X105,ORCL,ORACLE CORP COM,13953,4374,2.01M,631.41K,+45.7%,0.06%
20030N101,CMCSA,COMCAST CORP NEW CL A,34901,16825,1.29M,620.83K,+93.1%,0.04%
N6596X109,NXPI,NXP SEMICONDUCTORS N V COM,3098,3098,619.78K,619.78K,NEW,0.02%
64110L106,NFLX,NETFLIX INC COM,3179,662,2.96M,617.33K,+26.3%,0.09%
92343V104,VZ,VERIZON COMMUNICATIONS INC COM,19961,13543,905.43K,614.31K,+211%,0.03%
693475105,PNC,PNC FINL SVCS GROUP INC COM,3452,3452,606.76K,606.76K,NEW,0.02%
31428X106,FDX,FEDEX CORP COM,2445,2445,596.38K,596.38K,NEW,0.02%
931142103,WMT,WALMART INC COM,197873,6689,17.37M,587.17K,+3.5%,0.51%
539830109,LMT,LOCKHEED MARTIN CORP COM,2065,1294,917.16K,574.73K,+167.8%,0.03%
60770K107,MRNA,MODERNA INC COM,40772,17268,1.31M,554.65K,+73.5%,0.04%
835699307,SONY,SONY GROUP CORP SPONSORED ADR,21680,21680,550.89K,550.89K,NEW,0.02%
46090E103,QQQ,INVESCO QQQ TR UNIT SER 1,106418,1123,49.92M,526.78K,+1.1%,1.5%
37954A204,GMRE,GLOBAL MED REIT INC COM NEW,58073,58073,508.14K,508.14K,NEW,0.01%
615369105,MCO,MOODYS CORP COM,1051,1051,489.44K,489.44K,NEW,0.01%
718172109,PM,PHILIP MORRIS INTL INC COM,5345,2958,848.41K,469.52K,+123.9%,0.02%
00130H105,AES,AES CORP COM,35178,35178,436.91K,436.91K,NEW,0.01%
832696405,SJM,SMUCKER J M CO COM NEW,3519,3519,416.69K,416.69K,NEW,0.01%
60937P106,MDB,MONGODB INC CL A,19206,2371,3.37M,415.87K,+14.1%,0.1%
00287Y109,ABBV,ABBVIE INC COM,5687,1978,1.19M,414.43K,+53.3%,0.03%
440452100,HRL,HORMEL FOODS CORP COM,13371,13371,413.7K,413.7K,NEW,0.01%
902494103,TSN,TYSON FOODS INC CL A,6371,6371,406.53K,406.53K,NEW,0.01%
233331107,DTE,DTE ENERGY CO COM,2900,2900,400.98K,400.98K,NEW,0.01%
039483102,ADM,ARCHER DANIELS MIDLAND CO COM,8200,8200,393.68K,393.68K,NEW,0.01%
018802108,LNT,ALLIANT ENERGY CORP COM,6000,6000,386.1K,386.1K,NEW,0.01%
427866108,HSY,HERSHEY CO COM,2243,2243,383.62K,383.62K,NEW,0.01%
718546104,PSX,PHILLIPS 66 COM,3100,3100,382.79K,382.79K,NEW,0.01%
92840M102,VST,VISTRA CORP COM,3252,3252,381.92K,381.92K,NEW,0.01%
037833100,AAPL,APPLE INC COM,471257,1704,104.61M,378.25K,+0.4%,3.1%
97651M109,WIT,WIPRO LTD SPON ADR 1 SH,122498,122498,374.84K,374.84K,NEW,0.01%
244199105,DE,DEERE & CO COM,8280,798,3.86M,372.32K,+10.7%,0.11%
101137107,BSX,BOSTON SCIENTIFIC CORP COM,6073,3667,612.63K,369.92K,+152.4%,0.02%
372460105,GPC,GENUINE PARTS CO COM,3100,3100,369.33K,369.33K,NEW,0.01%
189054109,CLX,CLOROX CO DEL COM,2506,2506,369.01K,369.01K,NEW,0.01%
30212P303,EXPE,EXPEDIA GROUP INC COM NEW,4236,2108,713.48K,355.05K,+99.1%,0.02%
316773100,FITB,FIFTH THIRD BANCORP COM,9000,9000,352.8K,352.8K,NEW,0.01%
337738108,FI,FISERV INC COM,1571,1571,346.92K,346.92K,NEW,0.01%
277432100,EMN,EASTMAN CHEM CO COM,3900,3900,343.63K,343.63K,NEW,0.01%
731068102,PII,POLARIS INC COM,8300,8300,339.8K,339.8K,NEW,<.01%
067901108,B,BARRICK GOLD CORP COM,17370,17370,339.76K,339.76K,NEW,<.01%
110122108,BMY,BRISTOL-MYERS SQUIBB CO COM,5536,5536,337.64K,337.64K,NEW,<.01%
808513105,SCHW,SCHWAB CHARLES CORP COM,4228,4228,330.97K,330.97K,NEW,<.01%
053015103,ADP,AUTOMATIC DATA PROCESSING IN COM,1077,1077,329.06K,329.06K,NEW,<.01%
70450Y103,PYPL,PAYPAL HLDGS INC COM,18259,4741,1.26M,326.47K,+35.1%,0.04%
46284V101,IRM,IRON MTN INC DEL COM,81621,3790,7.02M,326.09K,+4.9%,0.21%
02209S103,MO,ALTRIA GROUP INC COM,5334,5334,320.15K,320.15K,NEW,<.01%
303250104,FICO,FAIR ISAAC CORP COM,386,167,711.85K,307.97K,+76.3%,0.02%
46434V886,HEWJ,ISHARES TR HDG MSCI JAPAN,89302,7145,3.75M,299.68K,+8.7%,0.11%
58155Q103,MCK,MCKESSON CORP COM,444,444,298.81K,298.81K,NEW,<.01%
81369Y506,XLE,SELECT SECTOR SPDR TR ENERGY,186347,3128,17.41M,292.31K,+1.7%,0.51%
94106L109,WM,WASTE MGMT INC DEL COM,1251,1251,289.62K,289.62K,NEW,<.01%
67103H107,ORLY,OREILLY AUTOMOTIVE INC COM,202,202,289.38K,289.38K,NEW,<.01%
713448108,PEP,PEPSICO INC COM,25710,1927,3.85M,288.88K,+8.1%,0.11%
98149E303,GLDM,WORLD GOLD TR SPDR GLD MINIS,459326,4667,28.43M,288.84K,+1%,0.83%
29786A106,ETSY,ETSY INC COM,6110,6110,288.27K,288.27K,NEW,<.01%
097023105,BA,BOEING CO COM,2999,1645,522.13K,286.4K,+121.5%,0.02%
09260D107,BX,BLACKSTONE INC COM,1939,1939,271.03K,271.03K,NEW,<.01%
893641100,TDG,TRANSDIGM GROUP INC COM,194,194,268.36K,268.36K,NEW,<.01%
22788C105,CRWD,CROWDSTRIKE HLDGS INC CL A,1602,732,587.23K,268.32K,+84.1%,0.02%
78467Y107,MDY,SPDR S&P MIDCAP 400 ETF TR UTSER1 S&PDCRP,500,500,266.68K,266.68K,NEW,<.01%
032654105,ADI,ANALOG DEVICES INC COM,1302,1302,262.57K,262.57K,NEW,<.01%
69608A108,PLTR,PALANTIR TECHNOLOGIES INC CL A,22250,3111,1.88M,262.57K,+16.3%,0.06%
81141R100,SE,SEA LTD SPONSORD ADS,1319888,1949,172.13M,254.17K,+0.1%,5%
075887109,BDX,BECTON DICKINSON & CO COM,1100,1100,251.97K,251.97K,NEW,<.01%
452308109,ITW,ILLINOIS TOOL WKS INC COM,1003,1003,248.75K,248.75K,NEW,<.01%
701094104,PH,PARKER-HANNIFIN CORP COM,406,406,246.79K,246.79K,NEW,<.01%
071813109,BAX,BAXTER INTL INC COM,7191,7191,246.15K,246.15K,NEW,<.01%
03831W108,APP,APPLOVIN CORP COM CL A,1675,896,443.77K,237.38K,+115%,0.01%
02079K107,GOOG,ALPHABET INC CAP STK CL C,85001,1510,13.27M,235.73K,+1.8%,0.39%
77543R102,ROKU,ROKU INC COM CL A,3319,3319,233.79K,233.79K,NEW,<.01%
14448C104,CARR,CARRIER GLOBAL CORPORATION COM,3424,3424,217.08K,217.08K,NEW,<.01%
126408103,CSX,CSX CORP COM,7366,7366,216.78K,216.78K,NEW,<.01%
281020107,EIX,EDISON INTL COM,3608,3608,212.58K,212.58K,NEW,<.01%
36828A101,GEV,GE VERNOVA INC COM,688,688,210.03K,210.03K,NEW,<.01%
888787108,TOST,TOAST INC CL A,6127,6127,203.23K,203.23K,NEW,<.01%
595017104,MCHP,MICROCHIP TECHNOLOGY INC. COM,11692,4010,578.54K,198.42K,+52.2%,0.02%
69331C108,PCG,PG&E CORP COM,10766,10766,184.96K,184.96K,NEW,<.01%
78409V104,SPGI,S&P GLOBAL INC COM,17419,355,8.85M,180.43K,+2.1%,0.26%
65339F101,NEE,NEXTERA ENERGY INC COM,5410,2246,383.51K,159.22K,+71%,0.01%
717081103,PFE,PFIZER INC COM,14765,5865,374.14K,148.62K,+65.9%,0.01%
75513E101,RTX,RTX CORPORATION COM,3185,1113,421.88K,147.43K,+53.7%,0.01%
902973304,USB,US BANCORP DEL COM NEW,9158,3345,395.9K,144.6K,+57.5%,0.01%
92189F106,GDX,VANECK ETF TRUST GOLD MINERS ETF,65220,2905,3M,133.55K,+4.7%,0.09%
11135F101,AVGO,BROADCOM INC COM,180216,774,30.19M,129.67K,+0.4%,0.88%
031162100,AMGN,AMGEN INC COM,1254,412,390.68K,128.36K,+48.9%,0.01%
907818108,UNP,UNION PAC CORP COM,1506,525,355.78K,124.03K,+53.5%,0.01%
863667101,SYK,STRYKER CORPORATION COM,888,327,330.56K,121.73K,+58.3%,<.01%
002824100,ABT,ABBOTT LABS COM,3444,914,456.85K,121.24K,+36.1%,0.01%
617446448,MS,MORGAN STANLEY COM NEW,2868,1002,334.61K,116.9K,+53.7%,<.01%
459200101,IBM,INTERNATIONAL BUSINESS MACHS COM,1658,436,412.28K,108.42K,+35.7%,0.01%
064058100,BK,BANK NEW YORK MELLON CORP COM,4186,1284,351.08K,107.69K,+44.2%,0.01%
025816109,AXP,AMERICAN EXPRESS CO COM,1256,387,337.93K,104.12K,+44.5%,<.01%
42824C109,HPE,HEWLETT PACKARD ENTERPRISE C COM,21027,6661,324.45K,102.78K,+46.4%,<.01%
35969L108,YMM,FULL TRUCK ALLIANCE CO LTD SPONSORED ADS,712986,8042,9.1M,102.7K,+1.1%,0.27%
46429B671,MCHI,ISHARES TR MSCI CHINA ETF,22124,1850,1.2M,100.64K,+9.1%,0.04%
882508104,TXN,TEXAS INSTRS INC COM,1884,508,338.56K,91.29K,+36.9%,<.01%
525327102,LDOS,LEIDOS HOLDINGS INC COM,1900,493,256.39K,66.53K,+35%,<.01%
500754106,KHC,KRAFT HEINZ CO COM,10296,1917,309.6K,57.64K,+22.9%,<.01%
169656105,CMG,CHIPOTLE MEXICAN GRILL INC COM,22478,1133,1.13M,56.89K,+5.3%,0.03%
90364P105,PATH,UIPATH INC CL A,19905,5010,205.02K,51.6K,+33.6%,<.01%
931427108,WBA,WALGREENS BOOTS ALLIANCE INC COM,21715,4194,242.34K,46.8K,+23.9%,<.01%
056752108,BIDU,BAIDU INC SPON ADR REP A,9126,469,898.18K,46.16K,+5.4%,0.03%
501242101,KLIC,KULICKE & SOFFA INDS INC COM,13995,1296,461.56K,42.74K,+10.2%,0.01%
824596100,SHG,SHINHAN FINANCIAL GROUP CO L SPN ADR RESTRD,38576,1214,1.23M,38.76K,+3.2%,0.04%
267475101,DY,DYCOM INDS INC COM,50220,235,7.65M,35.8K,+0.5%,0.22%
25809K105,DASH,DOORDASH INC CL A,3483,172,636.59K,31.44K,+5.2%,0.02%
46591M109,JOYY,JOYY INC ADS REPSTG COM A,10383,727,435.88K,30.52K,+7.5%,0.01%
747525103,QCOM,QUALCOMM INC COM,18797,101,2.9M,15.59K,+0.5%,0.09%
036752103,ELV,ELEVANCE HEALTH INC COM,714,17,310.56K,7.39K,+2.4%,<.01%
78440X887,SLG,SL GREEN RLTY CORP COM,37145,119,2.14M,6.87K,+0.3%,0.06%
654106103,NKE,NIKE INC CL B,32184,92,2.12M,6.05K,+0.3%,0.06%
464287200,IVV,ISHARES TR CORE S&P500 ETF,52227,0,29.35M,0,NO CHANGE,0.86%
46432F396,MTUM,ISHARES TR MSCI USA MMENTM,56981,0,11.52M,0,NO CHANGE,0.34%
81369Y886,XLU,SELECT SECTOR SPDR TR SBI INT-UTILS,135720,0,10.7M,0,NO CHANGE,0.31%
15677J108,DAY,DAYFORCE INC COM,87940,0,5.13M,0,NO CHANGE,0.15%
96208T104,WEX,WEX INC COM,30448,0,4.78M,0,NO CHANGE,0.14%
464288695,MXI,ISHARES TR GLOBAL MATER ETF,49634,0,4.06M,0,NO CHANGE,0.12%
464286350,VEGI,ISHARES INC MSCI AGRICULTURE,85390,0,3.16M,0,NO CHANGE,0.09%
857477103,STT,STATE STR CORP COM,30000,0,2.67M,0,NO CHANGE,0.08%
78464A755,XME,SPDR SER TR S&P METALS MNG,33333,0,1.86M,0,NO CHANGE,0.05%
G8994E103,TT,TRANE TECHNOLOGIES PLC SHS,5000,0,1.66M,0,NO CHANGE,0.05%
92189F676,SMH,VANECK ETF TRUST SEMICONDUCTR ETF,7615,0,1.61M,0,NO CHANGE,0.05%
464287457,SHY,ISHARES TR 1 3 YR TREAS BD,18902,0,1.56M,0,NO CHANGE,0.05%
538034109,LYV,LIVE NATION ENTERTAINMENT IN COM,10475,0,1.37M,0,NO CHANGE,0.04%
37954Y475,XYLD,GLOBAL X FDS S&P 500 COVERED,30718,0,1.21M,0,NO CHANGE,0.04%
68622V106,OGN,ORGANON & CO COMMON STOCK,60000,0,870.6K,0,NO CHANGE,0.03%
78440P306,SKM,SK TELECOM CO LTD SPONSORED ADR,38031,0,804.74K,0,NO CHANGE,0.02%
81369Y803,XLK,SELECT SECTOR SPDR TR TECHNOLOGY,3349,0,691.5K,0,NO CHANGE,0.02%
29452E101,EQH,EQUITABLE HLDGS INC COM,10653,0,554.91K,0,NO CHANGE,0.02%
26210C104,DBX,DROPBOX INC CL A,20325,0,542.88K,0,NO CHANGE,0.02%
48553T106,BZ,KANZHUN LIMITED SPONSORED ADS,26165,0,501.58K,0,NO CHANGE,0.01%
464287614,IWF,ISHARES TR RUS 1000 GRW ETF,1370,0,494.69K,0,NO CHANGE,0.01%
204166102,CVLT,COMMVAULT SYS INC COM,2504,0,395.03K,0,NO CHANGE,0.01%
36266G107,GEHC,GE HEALTHCARE TECHNOLOGIES I COMMON STOCK,4628,0,373.53K,0,NO CHANGE,0.01%
G3223R108,EG,EVEREST GROUP LTD COM,749,0,272.13K,0,NO CHANGE,<.01%
985817105,YELP,YELP INC CL A,5988,0,221.74K,0,NO CHANGE,<.01%
464286103,EWA,ISHARES INC MSCI AUST ETF,8600,0,201.58K,0,NO CHANGE,<.01%
756109104,O,REALTY INCOME CORP COM,13965,-35,810.11K,-2.03K,-0.2%,0.02%
42250P103,DOC,HEALTHPEAK PROPERTIES INC COM,48260,-121,975.82K,-2.45K,-0.3%,0.03%
518439104,EL,LAUDER ESTEE COS INC CL A,10738,-198,718.91K,-13.26K,-1.8%,0.02%
90138F102,TWLO,TWILIO INC CL A,2976,-166,291.38K,-16.25K,-5.3%,<.01%
336433107,FSLR,FIRST SOLAR INC COM,19669,-133,2.49M,-16.82K,-0.7%,0.07%
48241A105,KB,KB FINL GROUP INC SPONSORED ADR,3894,-333,210.7K,-18.02K,-7.9%,<.01%
294821608,ERIC,TELEFONAKTIEBOLAGET LM ERICS ADR B SEK 10,74040,-3737,574.55K,-29K,-4.8%,0.02%
02665T306,AMH,AMERICAN HOMES 4 RENT CL A,56862,-899,2.15M,-33.99K,-1.6%,0.06%
63633D104,NHI,NATIONAL HEALTH INVS INC COM,25756,-518,1.9M,-38.26K,-2%,0.06%
79466L302,CRM,SALESFORCE INC COM,147061,-150,39.62M,-40.41K,-0.1%,1.2%
720190206,PDM,PIEDMONT OFFICE REALTY TR IN COM CL A,246017,-5519,1.81M,-40.68K,-2.2%,0.05%
742718109,PG,PROCTER AND GAMBLE CO COM,19492,-316,3.32M,-53.85K,-1.6%,0.1%
925652109,VICI,VICI PPTYS INC COM,112904,-1787,3.68M,-58.29K,-1.6%,0.11%
554489104,VRE,VERIS RESIDENTIAL INC COM,297653,-3754,5.04M,-63.52K,-1.2%,0.15%
001055102,AFL,AFLAC INC COM,2539,-581,282.31K,-64.6K,-18.6%,<.01%
49427F108,KRC,KILROY RLTY CORP COM,89830,-2024,2.94M,-66.31K,-2.2%,0.09%
81369Y209,XLV,SELECT SECTOR SPDR TR SBI HEALTHCARE,20456,-468,2.99M,-68.33K,-2.2%,0.09%
233051754,ASHS,DBX ETF TR XTRACK CSI 500 A,18087,-2400,520.73K,-69.1K,-11.7%,0.02%
46429B309,EIDO,ISHARES TR MSCI INDONIA ETF,26035,-4341,424.37K,-70.76K,-14.3%,0.01%
828806109,SPG,SIMON PPTY GROUP INC NEW COM,61983,-460,10.29M,-76.4K,-0.7%,0.3%
G0250X107,AMCR,AMCOR PLC ORD,722888,-8175,6.97M,-78.81K,-1.1%,0.2%
315616102,FFIV,F5 INC COM,1761,-314,468.9K,-83.61K,-15.1%,0.01%
33734X846,CIBR,FIRST TR EXCHANGE TRADED FD NASDAQ CYB ETF,9027,-1336,568.7K,-84.17K,-12.9%,0.02%
62914V106,NIO,NIO INC SPON ADS,22357,-23253,88.98K,-92.55K,-51%,<.01%
166764100,CVX,CHEVRON CORP NEW COM,5080,-612,848.43K,-102.21K,-10.8%,0.02%
464287515,IGV,ISHARES TR EXPANDED TECH,8101,-1155,720.91K,-102.78K,-12.5%,0.02%
78468R663,BIL,SPDR SER TR BLOOMBERG 1-3 MO,30300,-1136,2.78M,-104.21K,-3.6%,0.08%
89677Q107,TCOM,TRIP COM GROUP LTD ADS,11539,-1713,752.11K,-111.65K,-12.9%,0.02%
464288760,ITA,ISHARES TR US AER DEF ETF,5561,-788,851.39K,-120.64K,-12.4%,0.02%
464286285,EMHY,ISHARES INC JP MRGN EM HI BD,17944,-3167,686K,-121.07K,-15%,0.02%
74340W103,PLD,PROLOGIS INC. COM,161475,-1120,18.05M,-125.2K,-0.7%,0.53%
46137V142,PHO,INVESCO EXCHANGE TRADED FD T WATER RES ETF,13562,-2002,875.02K,-129.17K,-12.9%,0.03%
74460D109,PSA,PUBLIC STORAGE OPER CO COM,15671,-454,4.69M,-135.88K,-2.8%,0.14%
770700102,HOOD,ROBINHOOD MKTS INC COM CL A,8556,-3320,356.1K,-138.18K,-28%,0.01%
40412C101,HCA,HCA HEALTHCARE INC COM,2744,-400,948.19K,-138.22K,-12.7%,0.03%
369604301,GE,GE AEROSPACE COM NEW,75578,-752,15.13M,-150.55K,-1%,0.44%
29084Q100,EME,EMCOR GROUP INC COM,704,-410,260.22K,-151.55K,-36.8%,<.01%
482497104,BEKE,KE HLDGS INC SPONSORED ADS,51345,-8170,1.03M,-164.05K,-13.7%,0.03%
852234103,XYZ,BLOCK INC CL A,80974,-3106,4.4M,-168.75K,-3.7%,0.13%
46429B663,HDV,ISHARES TR CORE HIGH DV ETF,13800,-1443,1.67M,-174.78K,-9.5%,0.05%
115236101,BRO,BROWN & BROWN INC COM,2534,-1613,315.23K,-200.66K,-38.9%,<.01%
345370860,F,FORD MTR CO COM,0,-20260,0,-203.21K,CLOSE,0%
91912E105,VALE,VALE S A SPONSORED ADS,0,-23464,0,-209.3K,CLOSE,0%
15135B101,CNC,CENTENE CORP DEL COM,5615,-3491,340.89K,-211.94K,-38.3%,<.01%
91913Y100,VLO,VALERO ENERGY CORP COM,2524,-1600,336.27K,-213.17K,-38.8%,<.01%
00508Y102,AYI,ACUITY BRANDS INC COM,0,-730,0,-213.25K,CLOSE,0%
380237107,GDDY,GODADDY INC CL A,0,-1108,0,-218.69K,CLOSE,0%
548661107,LOW,LOWES COS INC COM,0,-890,0,-219.65K,CLOSE,0%
256163106,DOCU,DOCUSIGN INC COM,0,-2496,0,-224.49K,CLOSE,0%
46138G649,QQQM,INVESCO EXCH TRADED FD TR II NASDAQ 100 ETF,94665,-1165,18.27M,-224.87K,-1.2%,0.54%
92343E102,VRSN,VERISIGN INC COM,0,-1087,0,-224.97K,CLOSE,0%
45409B107,QAI,NEW YORK LIFE INVESTMENTS ET NYLI HEDGE MULTI,51576,-7204,1.61M,-225.56K,-12.3%,0.05%
87165B103,SYF,SYNCHRONY FINANCIAL COM,0,-3492,0,-226.98K,CLOSE,0%
679295105,OKTA,OKTA INC CL A,0,-2889,0,-227.65K,CLOSE,0%
89417E109,TRV,TRAVELERS COMPANIES INC COM,1312,-863,346.97K,-228.23K,-39.7%,0.01%
09290D101,BLK,BLACKROCK INC COM,0,-223,0,-228.6K,CLOSE,0%
18915M107,NET,CLOUDFLARE INC CL A COM,0,-2088,0,-230.95K,CLOSE,0%
127190304,CACI,CACI INTL INC CL A,0,-595,0,-240.42K,CLOSE,0%
278642103,EBAY,EBAY INC. COM,0,-3902,0,-241.73K,CLOSE,0%
040413205,ANET,ARISTA NETWORKS INC COM SHS,60664,-3122,4.7M,-241.89K,-4.9%,0.14%
47215P106,JD,JD.COM INC SPON ADS CL A,6441,-5915,276.25K,-253.69K,-47.9%,<.01%
46434V803,HEFA,ISHARES TR HDG MSCI EAFE,37738,-7062,1.37M,-256.28K,-15.8%,0.04%
G0450A105,ACGL,ARCH CAP GROUP LTD ORD,4425,-2717,425.58K,-261.31K,-38%,0.01%
14149Y108,CAH,CARDINAL HEALTH INC COM,0,-2218,0,-262.32K,CLOSE,0%
620076307,MSI,MOTOROLA SOLUTIONS INC COM NEW,894,-603,391.4K,-264K,-40.3%,0.01%
72352L106,PINS,PINTEREST INC CL A,7777,-8588,241.09K,-266.23K,-52.5%,<.01%
052769106,ADSK,AUTODESK INC COM,1680,-1050,453.28K,-283.3K,-38.5%,0.01%
59156R108,MET,METLIFE INC COM,0,-3470,0,-284.14K,CLOSE,0%
651639106,NEM,NEWMONT CORP COM,8378,-5988,405.41K,-289.76K,-41.7%,0.01%
921946885,VWOB,VANGUARD WHITEHALL FDS EM MK GOV BD ETF,32745,-4566,2.1M,-293.14K,-12.2%,0.06%
983134107,WYNN,WYNN RESORTS LTD COM,0,-3368,0,-298.67K,CLOSE,0%
86800U302,SMCI,SUPER MICRO COMPUTER INC COM NEW,0,-9530,0,-304.77K,CLOSE,0%
743315103,PGR,PROGRESSIVE CORP COM,5499,-1092,1.56M,-309.05K,-16.6%,0.05%
871607107,SNPS,SYNOPSYS INC COM,19321,-722,8.29M,-309.63K,-3.6%,0.24%
46434G780,EWS,ISHARES INC MSCI SINGPOR ETF,0,-14500,0,-316.82K,CLOSE,0%
464286772,EWY,ISHARES INC MSCI STH KOR ETF,23772,-6314,1.28M,-341.21K,-21%,0.04%
464288182,AAXJ,ISHARES TR MSCI AC ASIA ETF,1231020,-4765,91.06M,-352.47K,-0.4%,2.7%
23804L103,DDOG,DATADOG INC CL A COM,0,-2553,0,-364.8K,CLOSE,0%
026874784,AIG,AMERICAN INTL GROUP INC COM NEW,0,-5055,0,-369.01K,CLOSE,0%
767204100,RIO,RIO TINTO PLC SPONSORED ADR,0,-6470,0,-381.79K,CLOSE,0%
609207105,MDLZ,MONDELEZ INTL INC CL A,3056,-5634,207.35K,-382.27K,-64.8%,<.01%
573874104,MRVL,MARVELL TECHNOLOGY INC COM,4464,-5917,289.54K,-383.78K,-57%,<.01%
806857108,SLB,SCHLUMBERGER LTD COM STK,9989,-9466,420.54K,-398.52K,-48.7%,0.01%
949746101,WFC,WELLS FARGO CO NEW COM,26826,-5595,1.93M,-401.67K,-17.3%,0.06%
22160K105,COST,COSTCO WHSL CORP NEW COM,2200,-450,2.08M,-425.52K,-17%,0.06%
693483109,PKX,POSCO HOLDINGS INC SPONSORED ADR,32310,-9009,1.57M,-438.92K,-21.8%,0.05%
375558103,GILD,GILEAD SCIENCES INC COM,3291,-3962,368.76K,-443.94K,-54.6%,0.01%
883556102,TMO,THERMO FISHER SCIENTIFIC INC COM,7000,-908,3.5M,-454.15K,-11.5%,0.1%
46434G848,PICK,ISHARES INC MSCI GBL ETF NEW,0,-13085,0,-457.84K,CLOSE,0%
88339J105,TTD,THE TRADE DESK INC COM CL A,0,-3930,0,-461.89K,CLOSE,0%
21037T109,CEG,CONSTELLATION ENERGY CORP COM,0,-2185,0,-488.81K,CLOSE,0%
647581206,EDU,NEW ORIENTAL ED & TECHNOLOGY SPON ADR,16143,-10338,772.44K,-494.67K,-39%,0.02%
92532F100,VRTX,VERTEX PHARMACEUTICALS INC COM,0,-1233,0,-496.53K,CLOSE,0%
571748102,MMC,MARSH & MCLENNAN COS INC COM,2323,-2140,566.88K,-522.22K,-47.9%,0.02%
78462F103,SPY,SPDR S&P 500 ETF TR TR UNIT,20352,-949,11.49M,-535.77K,-4.5%,0.34%
666807102,NOC,NORTHROP GRUMMAN CORP COM,408,-1051,208.9K,-538.12K,-72%,<.01%
25179M103,DVN,DEVON ENERGY CORP NEW COM,13098,-14833,483.05K,-547.04K,-53.1%,0.01%
464287101,OEF,ISHARES TR S&P 100 ETF,0,-1920,0,-554.59K,CLOSE,0%
437076102,HD,HOME DEPOT INC COM,7092,-1624,2.6M,-595.1K,-18.6%,0.08%
64110D104,NTAP,NETAPP INC COM,0,-5132,0,-595.68K,CLOSE,0%
G93A5A101,VIK,VIKING HOLDINGS LTD ORD SHS,0,-13544,0,-596.75K,CLOSE,0%
464288448,IDV,ISHARES TR INTL SEL DIV ETF,0,-22152,0,-606.52K,CLOSE,0%
149123101,CAT,CATERPILLAR INC COM,2916,-1887,972.85K,-629.55K,-39.3%,0.03%
N07059210,ASML,ASML HOLDING N V N Y REGISTRY SHS,10007,-953,6.9M,-657.32K,-8.7%,0.2%
922908736,VUG,VANGUARD INDEX FDS GROWTH ETF,2246,-1781,832.86K,-660.43K,-44.2%,0.02%
37045V100,GM,GENERAL MTRS CO COM,58600,-14143,2.74M,-660.92K,-19.4%,0.08%
501044101,KR,KROGER CO COM,0,-10608,0,-661.3K,CLOSE,0%
833445109,SNOW,SNOWFLAKE INC CL A,0,-4195,0,-665.54K,CLOSE,0%
464287630,IWN,ISHARES TR RUS 2000 VAL ETF,0,-4070,0,-668.21K,CLOSE,0%
90353T100,UBER,UBER TECHNOLOGIES INC COM,108481,-9132,7.94M,-668.32K,-7.8%,0.23%
060505104,BAC,BANK AMERICA CORP COM,11124,-16469,464.2K,-687.25K,-59.7%,0.01%
134748102,CAN,CANAAN INC SPONSORED ADS,0,-339957,0,-696.91K,CLOSE,0%
099502106,BAH,BOOZ ALLEN HAMILTON HLDG COR CL A,0,-5519,0,-710.29K,CLOSE,0%
922475108,VEEV,VEEVA SYS INC CL A COM,1713,-3081,396.78K,-713.65K,-64.3%,0.01%
46432F339,QUAL,ISHARES TR MSCI USA QLT FCT,249866,-4319,42.7M,-738.07K,-1.7%,1.3%
92204A306,VDE,VANGUARD WORLD FD ENERGY ETF,7130,-5730,924.83K,-743.24K,-44.6%,0.03%
30231G102,XOM,EXXON MOBIL CORP COM,9428,-6857,1.09M,-792.61K,-42.1%,0.03%
398182303,AHR,AMERICAN HEALTHCARE REIT INC COM SHS,211825,-26771,6.42M,-811.16K,-11.2%,0.19%
46434G772,EWT,ISHARES INC MSCI TAIWAN ETF,93811,-17954,4.45M,-852.46K,-16.1%,0.13%
580135101,MCD,MCDONALDS CORP COM,6656,-2736,2.08M,-855.35K,-29.1%,0.06%
254687106,DIS,DISNEY WALT CO COM,210193,-8962,20.72M,-883.57K,-4.1%,0.61%
23918K108,DVA,DAVITA INC COM,0,-6373,0,-983.35K,CLOSE,0%
85254J102,STAG,STAG INDL INC COM,82707,-27820,2.99M,-1M,-25.2%,0.09%
